{
  "schema_version": "1.0.0",
  "manifest_id": "acq_bls_qcew_total_2021",
  "source_id": "src_bls_qcew_total_2021",
  "source_url": "https://data.bls.gov/cew/data/api/2021/a/industry/10.csv",
  "request_url": "https://data.bls.gov/cew/data/api/2021/a/industry/10.csv",
  "retrieved_at": "2026-09-01T05:14:01Z",
  "http_status": 200,
  "sha256": "331d81786235e57217ef1498efc64d5e3abf39f1cbca1cf841ea10533920db51",
  "license": "U.S. government data",
  "parser_version": "county-economic-history-panel-v1",
  "attempt": 1,
  "created_at": "2026-09-01T05:14:01Z",
  "updated_at": "2026-09-01T05:14:01Z",
  "record_status": "active",
  "etag": "\"35975a-5e78e5d681485\"",
  "last_modified": "Wed, 31 Aug 2022 19:18:42 GMT"
}
