{
  "schema_version": "1.0.0",
  "manifest_id": "acq_pwc_iad14_lifecycle_20260831",
  "source_id": "src_pwc_data_center_gis_20260831",
  "source_url": "https://gisweb.pwcva.gov/arcgis/rest/services/Planning/Build_Out_Analysis/MapServer/9/query",
  "request_url": "https://gisweb.pwcva.gov/arcgis/rest/services/Planning/Build_Out_Analysis/MapServer/9/query?f=json&geometry=-77.5482168%2C38.7899318&geometryType=esriGeometryPoint&inSR=4326&spatialRel=esriSpatialRelIntersects&distance=1000&units=esriSRUnit_Meter&outFields=%2A&returnGeometry=false",
  "retrieved_at": "2026-08-31T23:45:00Z",
  "http_status": 200,
  "sha256": "be8d65ba622ecfcbc537bdeb2e2b46418faa9572256704ddd26c29ffb5e81e5e",
  "local_path": "data/raw/prince-william-county/lifecycle-tranche-1-iad14.json",
  "license": "Prince William County public GIS record; terms not independently determined",
  "parser_version": "pwc-lifecycle-gis-v1",
  "attempt": 1,
  "created_at": "2026-08-31T23:45:00Z",
  "updated_at": "2026-08-31T23:45:00Z",
  "record_status": "active"
}
