{
  "schema_version": "1.0.0",
  "manifest_id": "acq_bea_cagdp1_2024",
  "source_id": "src_bea_cagdp1_2024",
  "source_url": "https://apps.bea.gov/regional/zip/CAGDP1.zip",
  "request_url": "https://apps.bea.gov/regional/zip/CAGDP1.zip",
  "retrieved_at": "2026-09-01T03:55:38Z",
  "http_status": 200,
  "sha256": "95b49283df20772ded04ea53e1142955b8ade5e7f93047c0a3dfaf403b166fe1",
  "license": "U.S. government data",
  "parser_version": "bea-county-economic-baseline-v1",
  "attempt": 1,
  "created_at": "2026-09-01T03:55:38Z",
  "updated_at": "2026-09-01T03:55:38Z",
  "record_status": "active",
  "etag": "\"4748349ca396dc1:0\"",
  "last_modified": "Thu, 05 Feb 2026 13:30:35 GMT"
}
