{
  "schema_version": "1.0.0",
  "manifest_id": "acq_bea_cainc1_2024",
  "source_id": "src_bea_cainc1_2024",
  "source_url": "https://apps.bea.gov/regional/zip/CAINC1.zip",
  "request_url": "https://apps.bea.gov/regional/zip/CAINC1.zip",
  "retrieved_at": "2026-09-01T03:55:38Z",
  "http_status": 200,
  "sha256": "e1465c8b0e7e75f541241fe2fa64364b784dd6d2223901f9d576c4c5d49480b5",
  "license": "U.S. government data",
  "parser_version": "bea-county-economic-baseline-v1",
  "attempt": 1,
  "created_at": "2026-09-01T03:55:38Z",
  "updated_at": "2026-09-01T03:55:38Z",
  "record_status": "active",
  "etag": "\"315b1a8a396dc1:0\"",
  "last_modified": "Thu, 05 Feb 2026 13:30:56 GMT"
}
